ASIN,Product Name,Category,Keyword,Unit Count,Number of Reviews,Average Review Score,Manufacturer,Price
B0039LMTAQ,Gillette Venus Sensitive Women&#x27;s Disposable Razors - Single Package of 3 Razors (Packaging May Vary),razors,women,3,40235,4.6,,$6.94
B07CYN88NJ,"Amazon Basics 5-Blade Razor for Women, Handle, 12 Cartridges &amp; Shower Hanger, Fit Handles only, 14 Piece Set, Blue (Previously Solimo)",razors,women,12,34705,4.5,,$20.40
B0037LOPQY,"Gillette Venus Tropical Disposable Razors for Women, 3+1 Count, Designed for a Smooth Shave, Tropical Fragrance Scented Handles",razors,women,4,21863,4.6,,$6.94
B002L5WFT6,"BIC Soleil Smooth Scented Women’s Disposable Razor, 3 Blades with a Moisture Strip For a Silky Shave, Assorted, 4 Piece Razor Set",razors,women,4,10753,4.6,,$5.47
B0787K2Y6P,"BIC Silky Touch Women&#x27;s Disposable Razors, With 2 Blades, Pretty Pastel Razor Handles, 40 Count Value Pack of Shaving Razors",razors,women,40,14574,4.7,,$9.56
B07N6W7RPC,"Gillette Venus ComfortGlide Razors for Women, 1 Razor, 4 Razor Blade Refills, White Tea Scented Gel Bars (Pack of 1)",razors,women,5,16307,4.6,,$16.99
B07JWQX7V4,"Gillette Venus Simply 3 Sensitive Women&#x27;s Disposable Razors, Pack of 1 with 4 razors",razors,women,1,2647,4.4,,$5.99
B003EMNITQ,"Gillette Venus ComfortGlide Womens Razor Blade Refills, 6 Count,(Pack of 1) White Tea Scented Gel Bar Protects Against Skin Irritation",razors,women,6,16509,4.8,,$21.97
B07GCJT4JR,"BIC Soleil Smooth Colors Women&#x27;s Disposable Razors With Aloe Vera and vitamin E Lubricating Strip for Enhanced Glide, With 3 Blades, 10 Count",razors,women,10,34619,4.6,,$11.49
B001JQLNCS,"Gillette Venus ComfortGlide Disposable Razors for Women, 2 Count, White Tea Scented Moisture Bars for a Smooth Shave",razors,women,2,5117,4.6,,$6.97
B08RP8LL7V,"Amazon Basics 5 Blade FITS Razor for Women, Fits Amazon Basics and Venus Handles, Includes 1 FITS Handle, 2 Cartridges &amp; 1 Shower Hanger, Pink",razors,women,2,5344,4.4,,$7.35
B0039LMT9W,"Gillette Venus Simply3 Women&#x27;s Disposable Razors, 4 Count (Pack of 1)",razors,women,4,696,4.3,,$5.96
B09NCC4WT5,"BIC Soleil Escape Women&#x27;s Disposable Razors, 3 Blade Razor, Moisture Strip With 100% Natural Almond Oil, Lavender and Eucalyptus Scented Handles, 4 Pack Disposable Razors For Women Green",razors,women,4,768,4.6,,$4.39
B004B8IDFQ,"BIC Soleil Comfort 4-Blade Disposable Razors for Women Sensitive Skin Razor for a Smooth and Close Shave, 3 Piece Razor Set",razors,women,3,8105,4.6,,$5.47
B001JQLNGY,"Gillette Sensor3 Comfort Disposable Razors for Men, 8 Count, Lubrastrip Glides Easily Over Your Skin",razors,men,8,40286,4.5,,$9.99
B07CZCQ481,"Amazon Basics 5-Blade MotionSphere Razor for Men with Dual Lubrication and Precision Trimmer, Handle &amp; 16 Cartridges, Cartridges fit, Razor Handles only, 17 Piece Set, Black",razors,men,16,62260,4.3,,$25.38
B07DZYGDS3,"Gillette Fusion5 Razors for Men, 1 Razor, 4 Blade Refills, Lubrastrip for a More Comfortable Shave",razors,men,1,34829,4.7,,$20.00
B001JQLNHS,"Gillette Fusion5 Razor Refills for Men, 12 Razor Blade Refills",razors,men,12,38658,4.7,,$39.99
B00D1G8XA4,"BIC Comfort 3 Refillable Three-Blade Disposable Razor for Men, Sensitive Skin Razor For a Comfortable Shave, 1 Handle and 6 Cartridges, 7 Piece Razor Set",razors,men,1,24856,4.4,,$5.43
B004B8F8MM,"Gillette Fusion5 Power Razor Blade Refills, 8 Count, Lubrastrip for a More Comfortable Shave for Men",razors,men,8,52860,4.7,,$29.99
B07RWK8Y6D,"Amazon Basics 3-Blade Motion Sphere Razor for Men with Dual Lubrication, Handle &amp; 20 Cartridges, Cartridges fit Amazon Basics Razor Handles only, 21 Piece Set, Black (Previously Solimo)",razors,men,20,7166,4.3,,$15.72
B007BF7ELA,"BIC Flex 4 Refillable Razors for Men, Long-Lasting 4 Blade Razors for Sensitive Skin, 1 Handle and 4 Cartridges, 5 Piece Shaving Kit",razors,men,1,9730,4.4,,$6.42
B07DZYGDSF,"Gillette Fusion ProGlide Razors, Men 1 Gillette Razor, 4 Razor Blade Refills, Shields Against Skin Irritation",razors,men,1,18631,4.7,,$19.99
B07C3CRB4S,Gillette Sensor2 Plus Disposable Razor (52 Pack),razors,men,52,6276,4.7,,$30.40
B08J94S65H,"Schick Xtreme 3 Original Razor — Disposable Head Razor for Sensitive Skin, 12 Count",razors,men,12,1880,4.4,,$14.97
B09NWKQGJ1,"BIC Flex 5 Refillable Razors for Men, Long-Lasting 5 Blade Razors for a Smooth and Comfortable Shave, 1 Handle and 7 Cartridges, 8 Piece Shaving Kit",razors,men,1,17668,4.6,,$12.78
B09NX77X51,"BIC Flex 5 Titanium 5-Blade Disposable Razor for Men, Sensitive Skin Razor For a Smooth, Comfortable and Close Shave, 4 Piece Razor Set",razors,men,4,4040,4.7,,$10.92
B0B195LFHX,"Harry&#x27;s Men&#x27;s Disposable Razors, 3-Blade Razors with Lubricating Strip and Pivoting Head, 10 count",razors,men,10,864,4.1,,$9.67
B01N97PCBH,"Fructis Pure Clean Purifying Shampoo, Silicone-Free, 12.5 Fl Oz, 1 Count (Packaging May Vary)",shampoo,women,12,20368,4.5,,$3.47
B07525QJC8,L’Oréal Paris Elvive Total Repair 5 Repairing Shampoo for Damaged Hair Shampoo with Protein and Ceramide for Strong Silky Shiny Healthy Renewed Hair 28 Fl Oz,shampoo,women,28,32806,4.6,,$7.68
B00ADRH2OM,"OGX Thick &amp; Full + Biotin &amp; Collagen Volumizing Shampoo for Thin Hair, Thickening Shampoo with Vitamin B7 &amp; Hydrolyzed Wheat Protein, Paraben-Free, Sulfate-Free Surfactants, 13 fl oz",shampoo,women,13,5329,4.5,,$6.97
B07HMVMTN6,"Aveeno Scalp Soothing Shampoo, Apple Cider Vinegar Blend, 12 Fl Oz",shampoo,women,12,13770,4.4,,$5.99
B000TGEJT8,"OGX Nourishing Coconut Milk Shampoo for Strong, Healthy Hair with Coconut Oil, Egg White Protein, Sulfate-Free, 13 fl oz",shampoo,women,13,12730,4.6,,$6.97
B088SKYMF2,"Nexxus Clean and Pure Clarifying Shampoo, With ProteinFusion, Nourished Hair Care Silicone, Dye And Paraben Free 33.8 oz",shampoo,women,34,2421,4.5,,$18.99
B0BCR23QDG,"L’Oréal Paris Elvive Hyaluron Plump Hydrating Shampoo for Dehydrated, Dry Hair Infused with Hyaluronic Acid Care Complex, Paraben-Free, 12.6 Fl Oz",shampoo,women,12,1553,4.5,,$4.49
B000H0Y4NW,"Extra-Body Shampoo, Thickens + Volumizes, For Fine Hair",shampoo,women,10,4924,4.5,,$14.50
B084LHV2M1,Herbal Essences Hello hydration shampoo shampooing for hair 29.2 FL OZ (Packaging may vary),shampoo,women,30,2401,4.6,,$7.97
B084LHNR57,"Herbal Essences Rose Hips Smooth Shampoo, 29.2 fl oz",shampoo,women,29,3890,4.7,,$9.97
B084LJ5XJ3,"Herbal Essences Shine Collection Shampoo, 29.2 fl oz",shampoo,women,29,1999,4.7,,$9.97
B07D37PQGL,Olaplex No. 4 Bond Maintenance Shampoo,shampoo,women,8,70148,4.6,,$30.00
B000RYYI7K,Dove Ultra Care Shampoo Daily Moisture for Dry Hair Shampoo with Bio-Restore Complex 20.4 oz,shampoo,women,21,2199,4.6,,$5.98
B01MDTVV6T,"Fructis Curl Nourish Sulfate Free Moisturizing Shampoo, 12.5 Fl Oz, 1 Count (Packaging May Vary)",shampoo,women,12,5611,4.6,,$3.47
B0CP6D683W,"DOVE MEN+CARE DV M SH Charcoal 4p 31z Pump Purifying Shampoo Charcoal + Clay for Stronger, More Resilient Hair, with Plant-Based Cleansers, 31 oz",shampoo,men,31,31,4.9,,$9.99
B08Q427N3W,"Method Men 2-in-1 Shampoo and Conditioner, Sea and Surf, Paraben and Phthalate Free, 14 fl oz, 1 Ct",shampoo,men,14,316,4.6,,$10.98
B0CMVM7BBF,"Dove Men+Care 2-in-1 Shampoo + Conditioner Sandalwood &amp; Cardamom Oil for Thick &amp; Full Hair, + Vitamin B3 &amp; Mineral Complex, 17.5 oz",shampoo,men,17,32,4.9,,$10.99
B01INE0P6I,DOVE MEN + CARE Fortifying 2-in-1 Shampoo and Conditioner Fresh and Clean with Caffeine 4 Count For Everyday Care Helps Strengthen and Nourish Hair 12 oz,shampoo,men,47,9372,4.6,,$19.92
B003E1CYHO,"Tea Tree Special Shampoo, Deep Cleans, Refreshes Scalp, For All Hair Types, Especially Oily Hair",shampoo,men,10,55590,4.7,,$18.00
B08LHX596H,"Old Spice Reinvigorate Shampoo for Men with Tea Tree Oil, 21.9 Oz Each, Twin Pack",shampoo,men,43,1512,4.6,,$15.99
B08LR3HN72,"Old Spice Swagger 2-in-1 Shampoo and Conditioner for Men, Get Up To 80% Fuller-Looking Hair, 29.2 Fl Oz Each, Twin Pack",shampoo,men,59,3092,4.7,,$19.92
B07NFSPQ2H,"Head &amp; Shoulders 2-In-1 Shampoo And Conditioner, Anti Dandruff Treatment And Scalp Care, Lemon-Lime Scent Of Old Spice Pure Sport, 31.4 Fl Oz Each, Twin (Packaging May Vary)",shampoo,men,63,8180,4.8,,$27.81
B01N97PCBH,"Fructis Pure Clean Purifying Shampoo, Silicone-Free, 12.5 Fl Oz, 1 Count (Packaging May Vary)",shampoo,men,12,20368,4.5,,$3.47
B07YS58Y2C,"American Crew Shampoo for Men, Daily Cleanser, Naturally Derived, Vegan Formula, Citrus Mint Fragrance, 8.45 Fl Oz",shampoo,men,8,2345,4.6,,$9.98
B08LJ5PMB8,"Old Spice Fiji 2-in-1 Shampoo and Conditioner for Men, Get Up To 80% Fuller-Looking Hair, 21.9 Fl Oz Each, Twin Pack",shampoo,men,44,3560,4.7,,$17.58
B0CMVT1VS5,"Dove Men+Care 2-in-1 Shampoo + Conditioner Pure Fresh Orange &amp; Sage for Strong, Healthy-Looking Hair, with Vitamin C &amp; Mineral Complex, 17.5 oz",shampoo,men,17,39,4.6,,$10.99
B0B8XP27BN,"Every Man Jack 2-in-1 Tea Tree + Cedar Shampoo + Conditioner - Thicken, Cleanse, and Hydrate Hair with Coconut, Tea Tree Oil - Notes of Fresh Cedar - Naturally Derived and No Harmful Chemicals -24oz",shampoo,men,24,1955,4.5,,$18.99
B000RYYI7K,Dove Ultra Care Shampoo Daily Moisture for Dry Hair Shampoo with Bio-Restore Complex 20.4 oz,shampoo,men,21,2199,4.6,,$5.98
B0080PEM3S,Degree Advanced Antiperspirant Deodorant 72-Hour Sweat &amp; Odor Protection White Flowers &amp; Lychee Antiperspirant for Women with MotionSense Technology 2.6 oz,deodorant,women,3,24016,4.7,,$4.99
B08ZH9MZGX,"Lady Speed Stick Invisible Dry Antiperspirant Deodorant, Shower Fresh, 2.3oz, 4 Pack",deodorant,women,9,7447,4.7,,$6.78
B001ET76WG,"Degree Advanced Antiperspirant Deodorant Shower Clean, 48-Hour Sweat &amp; Odor Protection Antiperspirant for Women with MotionSense Technology 2.6 oz(Pack of 6)(Packaging May Vary)",deodorant,women,16,18776,4.7,,$14.38
B01HTJTPZA,Dove Advanced Care Antiperspirant Cool Essentials 4 Count Deodorant for Women For 48 Hour Protection And Soft And Comfortable Underarms 2.6 oz,deodorant,women,10,10154,4.8,,$12.98
B0CBCVPT69,Degree Advanced Antiperspirant Deodorant Vanilla &amp; Jasmine 72-Hour Sweat &amp; Odor Protection Antiperspirant For Women with MotionSense Technology 2.6 oz,deodorant,women,3,115,4.7,,$4.87
B00ZOIEHYS,"Dove Advanced Care Antiperspirant Caring Coconut, Deodorant Stick for Women, for 48 Hour Protection And Soft And Comfortable Underarms, 2.6 Ounce (Pack of 2)",deodorant,women,5,27350,4.7,,$9.88
B07GB3NVN1,"Native Deodorant | Natural Deodorant for Women and Men, 72 Hour Odor Control Aluminum Free with Baking Soda, Coconut Oil and Shea Butter | Coconut &amp; Vanilla",deodorant,women,3,83763,4.4,,$12.97
B078LTHTRY,Dove Advanced Care Invisible Antiperspirant Deodorant Stick No White Marks on 100 Colors Sheer Cool 48-Hour Sweat and Odor Protecting Deodorant for Women 2.6 oz,deodorant,women,1,12289,4.7,,$5.37
B00TJ6WLN0,"Mitchum Women&#x27;s Deodorant, Antiperspirant Stick, Triple Odor Defense Gel, 48 Hr Protection, Shower Fresh, 3.4 Oz (Pack of 2)",deodorant,women,7,18561,4.6,,$6.26
B000XGKL8C,"Secret Invisible Solid Antiperspirant and Deodorant for Women, Shower Fresh Scent, 2.6 oz",deodorant,women,3,6290,4.8,,$3.97
B00I69TI5K,"Dove Invisible Solid Antiperspirant Deodorant Stick for Women, Original Clean, For All Day Underarm Sweat &amp; Odor Protection 2.6 oz, 2 Count",deodorant,women,5,6239,4.8,,$6.88
B00HF3XSO0,Secret Clinical Strength Antiperspirant and Deodorant for Women Invisible Solid Completely Clean 2.6 Oz,deodorant,women,3,24079,4.7,,$12.97
B000XGKLEQ,Secret Original Fresh 2.7 oz Powder Body Deodorant for Women,deodorant,women,3,2315,4.7,,$3.97
B09NPVJ6NQ,"Secret Antiperspirant and Deodorant for Women Refreshing Lavender, Clear Gel, 48 Hr Odor Protection, 3.4 oz (Pack of 3)",deodorant,women,10,8186,4.6,,$20.49
B00TPRG5D0,"Degree Men Original Antiperspirant Deodorant for Men, Pack of 2, 48-Hour Sweat and Odor Protection, Cool Rush 2.7 oz",deodorant,men,5,3154,4.7,,$5.78
B072J2ZBPY,Degree Men UltraClear Antiperspirant Deodorant Black + White 4 count 72-Hour Sweat &amp; Odor Protection Antiperspirant For Men With MotionSense Technology 2.7 oz,deodorant,men,11,30954,4.7,,$16.50
B08NYHVJ5N,"Old Spice Aluminum Free Deodorant for Men, High Endurance Sport, 24/7 Odor Protection, 3 Oz Each, (Pack Of 3)",deodorant,men,9,10632,4.7,,$14.97
B08ZH6P1NY,"Speed Stick Men&#x27;s Deodorant, Regular, 3 Ounce, 4 Pack",deodorant,men,12,10251,4.6,,$6.89
B01HTJTMF8,"Dove Men + Care Antiperspirant Deodorant, 72hr Sweat &amp; Odor Protection, Vitamin E, Triple Moisturizer, 4 Pack",deodorant,men,1,27092,4.6,,$14.98
B004DH1AXM,"DOVE MEN + CARE Deodorant Stick Moisturizing Deodorant For 72-Hour Protection Clean Comfort Aluminum Free Deodorant For Men, 3 Ounce (Pack of 2)",deodorant,men,6,51704,4.5,,$12.78
B0B5B53NR7,"Gillette Clear Gel Men’s Antiperspirant and Deodorant, 72-Hour Sweat Protection, Cool Wave, #1 Clear Gel Brand for Men, 3.8 oz (Pack of 4)",deodorant,men,15,3127,4.7,,$20.92
B002VUAM46,"Degree Men Antiperspirant Deodorant Adventure 4 Count For Freshness and Odor Protection Deodorant for Men 2.7 oz, Woodsy, Stick",deodorant,men,11,21747,4.7,,$11.98
B09K3K32L6,"Every Man Jack Cedar + Red Sage Men’s Deodorant - Stay Fresh with Aluminum Free Deodorant For all Skin Types - Odor Crushing, Long Lasting, with Naturally Derived Ingredients - 3oz",deodorant,men,6,2291,4.1,,$14.99
B092N1D95M,"Harry&#x27;s Men&#x27;s Deodorant - Odor Control Deodorant - Aluminum-Free - Variety Pack - Stone, Shiso, Redwood, 2.5 Ounce (Pack of 3)",deodorant,men,7,6619,4.3,,$16.47
B08NYMBXG8,"Old Spice Aluminum Free Deodorant for Men, Refresh, 3 oz each, Pack of 3",deodorant,men,9,4364,4.6,,$14.97
B09NPNPKGS,"Old Spice Aluminum Free Deodorant for Men, Swagger Scent, 3.8 oz (Pack of 3)",deodorant,men,11,4971,4.6,,$20.91
B07D5HJST1,"Degree Men Original Antiperspirant Deodorant for Men, Pack of 2, 48-Hour Sweat and Odor Protection, Sport 2.7 oz",deodorant,men,5,738,4.7,,$5.78
B0014CQGMO,Degree Men Original Protection Antiperspirant Deodorant 48-Hour Sweat and Odor Protection Extreme Blast Antiperspirant For Men 2.7 oz,deodorant,men,3,61294,4.7,,$3.18
B08KT2Z93D,"eos Shea Better Body Lotion- Vanilla Cashmere, 24-Hour Moisture Skin Care, Lightweight &amp; Non-Greasy, Made with Natural Shea, Vegan, 16 fl oz",lotion,women,16,5860,4.7,,$8.37
B073CXZ8KR,"Nivea Oil Infused Body Lotion, Cherry Blossom Lotion with Jojoba Oil, Moisturizing Body Lotion for Dry Skin, 16.9 Fl Oz Pump Bottle",lotion,women,17,31710,4.7,,$7.28
B00DG8F02Q,"NIVEA Shea Nourish Body Lotion, Dry Skin Lotion with Shea Butter, 16.9 Fl Oz Pump Bottle",lotion,women,17,38954,4.6,,$5.81
B076G2XGY3,"NIVEA Essentially Enriched Body Lotion for Dry Skin, Pack of 2, 16.9 Fl Oz Pump Bottles",lotion,women,34,16802,4.7,,$10.98
B096W6F7H1,"Method Daily Lotion, Pure Peace, Plant-Based Moisturizer for 24 Hours of Hydration, 13.5 fl oz (Pack of 1)",lotion,women,13,1261,4.4,,$8.98
B003JT8PKQ,"Lubriderm Daily Moisture Lotion + Pro-Ceramide with Shea Butter &amp; Glycerin Helps Moisturize Dry Skin, Hydrating Face, Hand &amp; Body Lotion is Lightly Scented &amp; Non-Greasy, 24 fl. oz",lotion,women,24,30353,4.8,,$8.99
B07QBN245V,"Jergens Lavender Body Butter Body and Hand Lotion, Moisturizer for Women, 7 Fl Oz (Pack of 1), with Essential Oils for Indulgent Moisturization White",lotion,women,7,17334,4.5,,$7.97
B001459IEE,"Aveeno Daily Moisturizer, Body Lotion, For Dry Skin, Prebiotic Oat Fragrance Free, 18 fl. oz, Pack of 1",lotion,women,18,46457,4.7,,$6.98
B001PBOKRM,"Jergens Original Scent Dry Skin Lotion, Body and Hand Moisturizer for Long Lasting Skin Hydration, with HYDRALUCENCE blend and Cherry Almond Essence, 32 Ounce",lotion,women,32,19846,4.8,,$10.47
B000EGOG46,"Queen Helene Cocoa Butter Hand &amp; Body Lotion, 32 Oz (Packaging May Vary)",lotion,women,33,4301,4.5,,$3.98
B00W4TWD7I,"Jergens Skin Firming Body Lotion for Dry to Extra Dry Skin, Skin Tightening Cream with Collagen and Elastin, Hydralucence Blend Formula, 16.8 oz",lotion,women,17,9918,4.6,,$7.32
B0000AJ3PU,"Aveeno Stress Relief Moisturizing Body Lotion with Lavender, Natural Oatmeal and Chamomile &amp; Ylang-Ylang Essential Oils to Calm &amp; Relax, 12 fl. oz",lotion,women,12,31778,4.7,,$9.99
B00DG8F04Y,"NIVEA Essentially Enriched Body Lotion,Dry to Very Dry Skin, 16.9 Fl Oz, Package may vary",lotion,women,17,19988,4.7,,$5.81
B07DJWZLQL,"Neutrogena Hydro Boost Body Moisturizing Gel Cream with Hyaluronic Acid, Non-Greasy &amp; Fast Absorbing, Lightweight Hydrating Body Lotion for Normal to Dry Skin, Paraben- &amp; Dye-Free, 16 oz",lotion,women,16,28438,4.7,,$8.84
B00DEX61A8,"NIVEA MEN Maximum Hydration Body Lotion, 3-in-1 Nourishing Lotion for Men, 16.9 Fl Oz Bottle",lotion,men,17,20521,4.7,,$7.28
B01J9S17NW,"Vaseline Men&#x27;s Healing Moisture Hand &amp; Body Lotion For Dry or Cracked Skin Fast Absorbing Non-Greasy Lotion for Men 20.3 oz, Pack of 3",lotion,men,60,6891,4.7,,$16.79
B003JT8PKQ,"Lubriderm Daily Moisture Lotion + Pro-Ceramide with Shea Butter &amp; Glycerin Helps Moisturize Dry Skin, Hydrating Face, Hand &amp; Body Lotion is Lightly Scented &amp; Non-Greasy, 24 fl. oz",lotion,men,24,30353,4.8,,$8.99
B00AHH00MO,"Gold Bond Men&#x27;s Essentials Everyday Moisture Daily Body &amp; Hand Lotion, 14.5 oz., With Vitamin C",lotion,men,14,10905,4.7,,$9.99
B08DF1N618,"Breathable Body Lotion, 48 Hour Hydrating Lotion, Men&#x27;s Lotion, 13.5 Fl Oz Bottle",lotion,men,1,5595,4.6,,$7.29
B087Y28XLM,"Palmer&#x27;s Cocoa Butter Formula Men&#x27;s Lotion, 8.5 Ounce",lotion,men,9,1155,4.7,,$6.99
B0CKH5GJFN,Every Man Jack Mens Amber + Sandalwood Hand &amp; Body Lotion for All Skin Types - Dermatologist Tested &amp; Hypoallergenic - Nourish Skin with Lightweight Fast Absorbing Lotion - 13.5oz 2 Bottles,lotion,men,27,21,4.6,,$19.99
B00OW9OTN4,"Gold Bond Men&#x27;s Essentials Everyday Moisture Daily Body &amp; Hand Lotion, 21 oz., With Vitamin C",lotion,men,21,7255,4.7,,$11.99
B001459IEE,"Aveeno Daily Moisturizer, Body Lotion, For Dry Skin, Prebiotic Oat Fragrance Free, 18 fl. oz, Pack of 1",lotion,men,18,46457,4.7,,$6.98
B07RK4HST7,CeraVe Daily Moisturizing Lotion for Dry Skin | Body Lotion &amp; Face Moisturizer with Hyaluronic Acid and Ceramides | Daily Moisturizer | Fragrance Free | Oil-Free | 19 Ounce,lotion,men,19,105873,4.7,,$18.39
B076G2XGY3,"NIVEA Essentially Enriched Body Lotion for Dry Skin, Pack of 2, 16.9 Fl Oz Pump Bottles",lotion,men,34,16802,4.7,,$10.98
B0859LBY9C,"Bevel All Day Body Lotion for Men with Shea Butter and Argan Oil, Lightweight Formula Softens and Smoothes Skin, 16 Oz",lotion,men,16,1240,4.6,,$10.99
B0C4Q8DZNW,"Vaseline Lotion for Dry Skin - Men Extra Strength Lotion, Fast-Absorbing Body Lotion Jelly and Ultra-Hydrating Lipids, 3-in-1 Body, Face, &amp; Hands, 10 Oz Ea (Pack of 2)",lotion,men,20,115,4.6,,$12.99
B01HTJTV4U,"Vaseline Intensive Care Body Lotion for Dry Skin Cocoa Radiant Lotion Made with Ultra-Hydrating Lipids and Pure Cocoa Butter for a Long-Lasting, Radiant Glow 20.3 oz, Pack of 3",lotion,men,62,11123,4.8,,$20.94
B074P2DH7K,"O Naturals 100% Natural Bar Soap - Assorted 6 PCS Soap Gift Set - Organic Ingredients &amp; Essential Oils - Spa Gifts for Women &amp; Men, Body Wash Soap Bar &amp; Face Soap for Acne - Triple Milled Soap Bars",soap,women,24,23082,4.4,,$19.99
B019FCVA02,"Dove Beauty Bar Gentle Skin Cleanser Moisturizing for Gentle Soft Skin Care Indulging Sweet Cream More Moisturizing Than Bar Soap, 3.75 Ounce (Pack of 2)",soap,women,8,2963,4.6,,$4.29
B00IOVOCFQ,"Dove Beauty Bar For Softer Skin Coconut Milk More Moisturizing Than Bar Soap, 3.75 Ounce - 6 Count (Pack of 1) - Packaging May Vary",soap,women,22,21531,4.7,,$7.85
B002TSA93Y,Dove Beauty Bar Skin Cleanser for Gentle Soft Skin Care Shea Butter More Moisturizing Than Bar Soap 3.75 oz 8 Bars,soap,women,30,15202,4.8,,$10.64
B093K5NTSB,"Bali Soap - Feminine Collection Natural Soap Bar Gift Set, 6 pc Variety Pack, Bergamot-Gardenia, Jasmine-Mint, Lotus-Neroli, Chamomile-Moringa, Tuberose-Lily, Greentea-Lime 3.5 Oz each",soap,women,21,3567,4.3,,$19.95
B09XQXV7GS,Yoni Soap Bar - Pack 3 Ph Balance Probiotics &amp; Natural Ingredients - Gentle Cleansing Formula Eliminates Odor Vaginal Health - Feminine Wash - Moisturizing Intimate (Rose),soap,women,11,469,4.2,,$9.99
B00XBGOPEW,"Bali Soap - Green Collection - Natural Soap Bar Gift Set, Face Soap or Body Soap, 6 pc Variety Soap Pack (Coconut, Papaya, Vanilla, Lemongrass, Jasmine, Ylang-Ylang) 3.5 Oz each",soap,women,21,12789,4.3,,$19.95
B00YQ9PPB0,"Bundle of 6 Greenwich Bay Trading Co. Soaps - 1.9oz Soaps in The Following Scents: Fresh Milk, Lemon Verbena, White Tea Calendula, Lavender Chamomile, Pomegranate Shea Butter, and Passion Flower and",soap,women,11,1045,4.5,,$9.99
B08TNTD2ZL,"Camay Classic Bar Soap, with Rose Essence, 4.98 Ounce (Pack of 6)",soap,women,530,2589,4.3,,$5.30
B07NF4GRHW,"Floral 4 large Soap bar - Flower scents Lavender, Lilac, Hydrangea - Anniversary Wedding Gift Set - Handmade Natural Organic with Essential Oil, Pink, 5 Ounce (Pack of 4)",soap,women,20,728,4.5,,$17.74
B07CMFDSGK,"Crate 61, Vegan Natural Bar Soap, Dry Skin, Handmade Soap With Premium Essential Oils, Pack of 6 (Citrus)",soap,women,24,36203,4.5,,$22.95
B07QB4XVQ4,"Wavertree &amp; London English Rose (2 Bars), 7oz Moisturizing Natural Soap Bar, French -Milled and enriched with Shea Butter",soap,women,14,1733,4.6,,$16.95
B08LM864R5,"Dove Skin Care Beauty Bar For Softer Skin Cucumber and Green Tea More Moisturizing Than Bar Soap 3.75 oz, 14 Bars",soap,women,53,24288,4.8,,$12.67
B00MYK7WPU,Spring Garden Bloom Flower Shea Butter Soap Gift Set,soap,women,11,1012,4.5,,$12.00
B086K1S96X,"DOVE MEN + CARE Bar 3 in 1 Cleanser for Body, Face, and Shaving to Clean and Hydrate Skin Extra Fresh Body and Facial Cleanser More Moisturizing Than Bar Soap 3.75 oz 14 Bars",soap,men,52,25131,4.8,,$11.48
B07NF95CY9,"360 Feel Men&#x27;s Soap bar Handmade -Masculine fragrance-, Patchouli, Pine Tar with Charcoal Beeswax,Citrus - Gift pack- Natural Men Soap- Gift for him Bay Rum, 4 Count (Pack of 1)",soap,men,20,16324,4.3,,$15.14
B002TSA90W,"Dove Men+Care Body and Face Bar More Moisturizing Than Bar Soap Deep Clean Effectively Washes Away Bacteria, Nourishes Your Skin, 3.75 Ounce (Pack of 8)",soap,men,30,12099,4.7,,$10.97
B079FXP68X,"Irish Spring Icy Blast Bar Soap for Men, Mens Soap, Smell Fresh and Clean 12 Hours, Men Bars Washing Hands Body, Mild Skin, Recyclable Carton, 24 Pack, 3.7 Oz",soap,men,89,28088,4.8,,$15.94
B091H17R79,"Bali Soap - Masculine Collection Natural Soap Bar Gift Set, 6 pc Variety Pack, Lemon-Pine, Ginger-Coffee, Sandalwood-Mint, Agarwood-Spice, Clove-Cinnamon, Eucalyptus-Lime 3.5 Oz each",soap,men,21,3567,4.3,,$19.95
B07VF8GPNL,San Francisco Soap Company Midnight Amber Fragrance Man Bar - Moisturizing - No Harmful Chemicals - Good for All Skin Types - Made in the USA,soap,men,1,926,4.6,,$9.99
B09YJXC1WJ,"Dr. Squatch Men&#x27;s Natural Bar Soap from Moisturizing Soap Made from Natural Oils - Cold Process Soap with No Harsh Chemicals - Wood Barrel Bourbon, Fresh Falls, Birchwood Breeze (3 Pack)",soap,men,15,10148,4.6,,$30.45
B01N49QENL,DOVE MEN + CARE Body and Face Bar Minerals + Sage 6 Bars to Hydrate Skin More Moisturizing Than Bar Soap 3.75 oz,soap,men,23,3968,4.7,,$9.00
B0C43ZLQFN,"Every Man Jack Amber + Sandalwood Mens Soap Bar for Body and Hair with Shea Butter, Aloe Vera, and Glycerin to Clean, Hydrate, and Soothe Skin - Naturally Derived, Zero Harmful Chemicals - 3 Pack",soap,men,15,113,4.5,,$19.99
B079FDZBPK,"San Francisco Soap Company Revitalizing Man Bar, Exotic Musk &amp; Sandalwood, 10 Ounce",soap,men,1,871,4.6,,$9.99
B09YN9JPJY,Mens Soap Bar Set 6Pcs Natural Handmade Cleansing Bar Soap Set Moisturizing&amp;Exfoliating Scrub Soap Gift for Men All Skin Type| 6 Different Scents |3.5 oz of 6 Bars,soap,men,25,1074,4.2,,$18.99
B06X95YPCW,"No. 102 Men&#x27;s Body Scrub Soap 7 oz, Fresh Original Woodsy Scent, Best Exfoliating Bar for Men, Made with Natural Ingredients, Apricot Seed Powder, Shea Butter, Olive Oil, Green Tea Extracts",soap,men,7,14084,4.6,,$9.99
B076PQMDLW,"Duke Cannon Supply Co. Big Brick of Soap - Superior Grade, Extra Large Men&#x27;s Bar Soap with Masculine Scents, Body Soap, All Skin Types, 10 oz",soap,men,1,2827,4.7,,$7.98
B0B5HP3XXM,"DOVE MEN + CARE Natural Essential Oil Bar Soap Exfoliating Charcoal + Clove Oil 4 Count To Clean And Hydrate Mens Skin 4-in-1 Bar Soap For Men&#x27;s Body, Hair, Face And Shave 5oz",soap,men,20,1596,4.4,,$23.74
B0752CBW5T,L’Oréal Paris Elvive Total Repair 5 Repairing Conditioner for Damaged Hair Conditioner with Protein and Ceramide for Strong Silky Shiny Healthy Renewed Hair 28 Fl Oz,conditioner,women,28,10695,4.6,,$7.79
B0BCR3DNM5,"L’Oréal Paris Elvive Hyaluron Plump Hydrating Conditioner for Dehydrated, Dry Hair Infused with Hyaluronic Acid Care Complex, Paraben-Free, 12.6 Fl Oz",conditioner,women,12,1793,4.5,,$4.49
B092PVHFL3,"MONDAY HAIRCARE Moisture Conditioner 12oz for Dry, Coarse, Stressed, Coily and Curly Hair, Made from Coconut Oil, Rice Protein, Shea Butter, &amp; Vitamin E, 100% Recyclable Bottles (350ml) (10434)",conditioner,women,12,643,4.5,,$5.97
B09GTVVWTK,"Pantene Conditioner Twin Pack with Hair Treatment, Daily Moisture Renewal for Dry Hair, Safe for Color-Treated Hair",conditioner,women,50,875,4.7,,$15.91
B07D37SBHF,No. 5 Bond Maintenance Conditioner,conditioner,women,8,68231,4.6,,$30.00
B0BMJGYVRW,"Mielle Organics Rosemary Mint Strengthening Conditioner with Biotin, 12 Ounce",conditioner,women,12,4331,4.6,,$8.99
B074VLNPSG,"Fructis Grow Strong Conditioner, 33.8 Fl Oz, 1 Count (Packaging May Vary)",conditioner,women,34,11552,4.6,,$8.47
B00ADR6M2U,"OGX Thick &amp; Full + Biotin &amp; Collagen Volumizing Conditioner for Thin Hair, with Vitamin B7 &amp; Hydrolyzed Wheat Protein, Paraben-Free, Sulfate-Free Surfactants, 13 fl oz",conditioner,women,13,8306,4.5,,$6.97
B088LJHK2F,"Nexxus Clean and Pure Conditioner, With ProteinFusion, Nourished Hair Care Silicone, Dye And Paraben Free 33.8 oz",conditioner,women,34,919,4.6,,$18.99
